<?xml version="1.0" encoding="UTF-8"?>
<projects count="0" xmlns:xsi="http://www.w3.org/2001/XMLSchema-instance" xsi:noNamespaceSchemaLocation="projectlist_schema.xsd">
  <project projectname="">
    <name>name</name>
    <lastmod>2001-12-31T12:00:00</lastmod>
    <description>description</description>
    <key>key</key>
    <userlist>
      <user>user</user>
    </userlist>
  </project>
</projects>
